{
  "contract_version": "1.0.0",
  "external_run_id": "tg-20260803-0001",
  "source": "telegram",
  "source_metadata": {
    "chat_id": "12345",
    "message_id": "67890"
  },
  "audio": {
    "signed_url": "https://example.com/audio/voice-note-1.mp3"
  },
  "editorial_options": {
    "language": "en-US",
    "tone": "professional",
    "target_length": "medium"
  },
  "proper_noun_hints": ["WordPress", "Gutenberg"],
  "publish_options": {
    "status": "draft",
    "post_type": "post"
  },
  "media_options": {
    "gallery_image_ids": [101, 102]
  }
}
